{"candidate_hash": "298c1c7a1077cfea", "candidate_name": "grid-0015[far_threshold_px=40.0,long_horizon_threshold_ratio=0.95,min_repeat=3,near_margin_ratio=1.5]", "cost_usd": 0.0, "delta_vs_best": -0.1109, "eval_set_hash": "20c83ed3cbce3d37", "executor": "detector", "experiment_id": "exp-0016", "notes": "tier1.py defaults + judge protocol v1", "parent_hash": "308d125283a522f3", "primary_calibration": 0.7177, "primary_holdout": 0.1333, "run_id": "det-grid-001", "scores": {"calibration": {"exact_match_rate": 0.5833, "macro_f1": 0.7177, "mean_jaccard": 0.625, "micro_f1": 0.7273, "n": 12, "per_leaf": {"Action Looping (Repetition)": {"f1": 0.8571, "fn": 1, "fp": 0, "precision": 1.0, "recall": 0.75, "tp": 3}, "Click Region Error": {"f1": 0.5, "fn": 2, "fp": 0, "precision": 1.0, "recall": 0.3333, "tp": 1}, "Goal Hallucination": {"f1": 0.0, "fn": 2, "fp": 0, "precision": 0.0, "recall": 0.0, "tp": 0}, "Hidden Operation Blindness": {"f1": 0.0, "fn": 0, "fp": 0, "precision": 0.0, "recall": 0.0, "tp": 0}, "Location Hallucination": {"f1": 0.6667, "fn": 0, "fp": 1, "precision": 0.5, "recall": 1.0, "tp": 1}, "Long-Horizon Memory Failure": {"f1": 1.0, "fn": 0, "fp": 0, "precision": 1.0, "recall": 1.0, "tp": 1}, "Spatial Reasoning Error": {"f1": 1.0, "fn": 0, "fp": 0, "precision": 1.0, "recall": 1.0, "tp": 1}, "Text Matching Bias": {"f1": 1.0, "fn": 0, "fp": 0, "precision": 1.0, "recall": 1.0, "tp": 1}}, "primary": 0.7177, "primary_metric": "macro_f1"}, "holdout": {"exact_match_rate": 0.2, "macro_f1": 0.1333, "mean_jaccard": 0.2, "micro_f1": 0.2857, "n": 5, "per_leaf": {"Action Looping (Repetition)": {"f1": 0.0, "fn": 1, "fp": 0, "precision": 0.0, "recall": 0.0, "tp": 0}, "Click Region Error": {"f1": 0.0, "fn": 1, "fp": 0, "precision": 0.0, "recall": 0.0, "tp": 0}, "Goal Hallucination": {"f1": 0.0, "fn": 1, "fp": 0, "precision": 0.0, "recall": 0.0, "tp": 0}, "Hidden Operation Blindness": {"f1": 0.0, "fn": 1, "fp": 0, "precision": 0.0, "recall": 0.0, "tp": 0}, "Location Hallucination": {"f1": 0.6667, "fn": 0, "fp": 1, "precision": 0.5, "recall": 1.0, "tp": 1}, "Long-Horizon Memory Failure": {"f1": 0.0, "fn": 0, "fp": 0, "precision": 0.0, "recall": 0.0, "tp": 0}, "Spatial Reasoning Error": {"f1": 0.0, "fn": 0, "fp": 0, "precision": 0.0, "recall": 0.0, "tp": 0}, "Text Matching Bias": {"f1": 0.0, "fn": 0, "fp": 0, "precision": 0.0, "recall": 0.0, "tp": 0}}, "primary": 0.1333, "primary_metric": "macro_f1"}}, "timestamp": "2026-08-10T23:34:05Z", "verdict": "discarded"}
{"candidate_hash": "54820a6a1bf61cff", "candidate_name": "grid-0016[far_threshold_px=40.0,long_horizon_threshold_ratio=0.95,min_repeat=3,near_margin_ratio=3.0]", "cost_usd": 0.0, "delta_vs_best": -0.1109, "eval_set_hash": "20c83ed3cbce3d37", "executor": "detector", "experiment_id": "exp-0017", "notes": "tier1.py defaults + judge protocol v1", "parent_hash": "308d125283a522f3", "primary_calibration": 0.7177, "primary_holdout": 0.1333, "run_id": "det-grid-001", "scores": {"calibration": {"exact_match_rate": 0.5833, "macro_f1": 0.7177, "mean_jaccard": 0.625, "micro_f1": 0.7273, "n": 12, "per_leaf": {"Action Looping (Repetition)": {"f1": 0.8571, "fn": 1, "fp": 0, "precision": 1.0, "recall": 0.75, "tp": 3}, "Click Region Error": {"f1": 0.5, "fn": 2, "fp": 0, "precision": 1.0, "recall": 0.3333, "tp": 1}, "Goal Hallucination": {"f1": 0.0, "fn": 2, "fp": 0, "precision": 0.0, "recall": 0.0, "tp": 0}, "Hidden Operation Blindness": {"f1": 0.0, "fn": 0, "fp": 0, "precision": 0.0, "recall": 0.0, "tp": 0}, "Location Hallucination": {"f1": 0.6667, "fn": 0, "fp": 1, "precision": 0.5, "recall": 1.0, "tp": 1}, "Long-Horizon Memory Failure": {"f1": 1.0, "fn": 0, "fp": 0, "precision": 1.0, "recall": 1.0, "tp": 1}, "Spatial Reasoning Error": {"f1": 1.0, "fn": 0, "fp": 0, "precision": 1.0, "recall": 1.0, "tp": 1}, "Text Matching Bias": {"f1": 1.0, "fn": 0, "fp": 0, "precision": 1.0, "recall": 1.0, "tp": 1}}, "primary": 0.7177, "primary_metric": "macro_f1"}, "holdout": {"exact_match_rate": 0.2, "macro_f1": 0.1333, "mean_jaccard": 0.2, "micro_f1": 0.2857, "n": 5, "per_leaf": {"Action Looping (Repetition)": {"f1": 0.0, "fn": 1, "fp": 0, "precision": 0.0, "recall": 0.0, "tp": 0}, "Click Region Error": {"f1": 0.0, "fn": 1, "fp": 0, "precision": 0.0, "recall": 0.0, "tp": 0}, "Goal Hallucination": {"f1": 0.0, "fn": 1, "fp": 0, "precision": 0.0, "recall": 0.0, "tp": 0}, "Hidden Operation Blindness": {"f1": 0.0, "fn": 1, "fp": 0, "precision": 0.0, "recall": 0.0, "tp": 0}, "Location Hallucination": {"f1": 0.6667, "fn": 0, "fp": 1, "precision": 0.5, "recall": 1.0, "tp": 1}, "Long-Horizon Memory Failure": {"f1": 0.0, "fn": 0, "fp": 0, "precision": 0.0, "recall": 0.0, "tp": 0}, "Spatial Reasoning Error": {"f1": 0.0, "fn": 0, "fp": 0, "precision": 0.0, "recall": 0.0, "tp": 0}, "Text Matching Bias": {"f1": 0.0, "fn": 0, "fp": 0, "precision": 0.0, "recall": 0.0, "tp": 0}}, "primary": 0.1333, "primary_metric": "macro_f1"}}, "timestamp": "2026-08-10T23:34:05Z", "verdict": "discarded"}
{"candidate_hash": "fa9fc678c9ead572", "candidate_name": "grid-0017[far_threshold_px=40.0,long_horizon_threshold_ratio=0.95,min_repeat=3,near_margin_ratio=5.0]", "cost_usd": 0.0, "delta_vs_best": -0.0204, "eval_set_hash": "20c83ed3cbce3d37", "executor": "detector", "experiment_id": "exp-0018", "notes": "tier1.py defaults + judge protocol v1", "parent_hash": "308d125283a522f3", "primary_calibration": 0.8082, "primary_holdout": 0.4, "run_id": "det-grid-001", "scores": {"calibration": {"exact_match_rate": 0.6667, "macro_f1": 0.8082, "mean_jaccard": 0.7083, "micro_f1": 0.8182, "n": 12, "per_leaf": {"Action Looping (Repetition)": {"f1": 0.8571, "fn": 1, "fp": 0, "precision": 1.0, "recall": 0.75, "tp": 3}, "Click Region Error": {"f1": 0.8, "fn": 1, "fp": 0, "precision": 1.0, "recall": 0.6667, "tp": 2}, "Goal Hallucination": {"f1": 0.0, "fn": 2, "fp": 0, "precision": 0.0, "recall": 0.0, "tp": 0}, "Hidden Operation Blindness": {"f1": 0.0, "fn": 0, "fp": 0, "precision": 0.0, "recall": 0.0, "tp": 0}, "Location Hallucination": {"f1": 1.0, "fn": 0, "fp": 0, "precision": 1.0, "recall": 1.0, "tp": 1}, "Long-Horizon Memory Failure": {"f1": 1.0, "fn": 0, "fp": 0, "precision": 1.0, "recall": 1.0, "tp": 1}, "Spatial Reasoning Error": {"f1": 1.0, "fn": 0, "fp": 0, "precision": 1.0, "recall": 1.0, "tp": 1}, "Text Matching Bias": {"f1": 1.0, "fn": 0, "fp": 0, "precision": 1.0, "recall": 1.0, "tp": 1}}, "primary": 0.8082, "primary_metric": "macro_f1"}, "holdout": {"exact_match_rate": 0.4, "macro_f1": 0.4, "mean_jaccard": 0.4, "micro_f1": 0.5714, "n": 5, "per_leaf": {"Action Looping (Repetition)": {"f1": 0.0, "fn": 1, "fp": 0, "precision": 0.0, "recall": 0.0, "tp": 0}, "Click Region Error": {"f1": 1.0, "fn": 0, "fp": 0, "precision": 1.0, "recall": 1.0, "tp": 1}, "Goal Hallucination": {"f1": 0.0, "fn": 1, "fp": 0, "precision": 0.0, "recall": 0.0, "tp": 0}, "Hidden Operation Blindness": {"f1": 0.0, "fn": 1, "fp": 0, "precision": 0.0, "recall": 0.0, "tp": 0}, "Location Hallucination": {"f1": 1.0, "fn": 0, "fp": 0, "precision": 1.0, "recall": 1.0, "tp": 1}, "Long-Horizon Memory Failure": {"f1": 0.0, "fn": 0, "fp": 0, "precision": 0.0, "recall": 0.0, "tp": 0}, "Spatial Reasoning Error": {"f1": 0.0, "fn": 0, "fp": 0, "precision": 0.0, "recall": 0.0, "tp": 0}, "Text Matching Bias": {"f1": 0.0, "fn": 0, "fp": 0, "precision": 0.0, "recall": 0.0, "tp": 0}}, "primary": 0.4, "primary_metric": "macro_f1"}}, "timestamp": "2026-08-10T23:34:05Z", "verdict": "discarded"}
{"candidate_hash": "6ea69f280cb7b02c", "candidate_name": "grid-0018[far_threshold_px=80.0,long_horizon_threshold_ratio=0.7,min_repeat=2,near_margin_ratio=1.5]", "cost_usd": 0.0, "delta_vs_best": -0.0905, "eval_set_hash": "20c83ed3cbce3d37", "executor": "detector", "experiment_id": "exp-0019", "notes": "tier1.py defaults + judge protocol v1", "parent_hash": "308d125283a522f3", "primary_calibration": 0.7381, "primary_holdout": 0.3333, "run_id": "det-grid-001", "scores": {"calibration": {"exact_match_rate": 0.6667, "macro_f1": 0.7381, "mean_jaccard": 0.7083, "micro_f1": 0.7826, "n": 12, "per_leaf": {"Action Looping (Repetition)": {"f1": 1.0, "fn": 0, "fp": 0, "precision": 1.0, "recall": 1.0, "tp": 4}, "Click Region Error": {"f1": 0.5, "fn": 2, "fp": 0, "precision": 1.0, "recall": 0.3333, "tp": 1}, "Goal Hallucination": {"f1": 0.0, "fn": 2, "fp": 0, "precision": 0.0, "recall": 0.0, "tp": 0}, "Hidden Operation Blindness": {"f1": 0.0, "fn": 0, "fp": 0, "precision": 0.0, "recall": 0.0, "tp": 0}, "Location Hallucination": {"f1": 1.0, "fn": 0, "fp": 0, "precision": 1.0, "recall": 1.0, "tp": 1}, "Long-Horizon Memory Failure": {"f1": 0.6667, "fn": 0, "fp": 1, "precision": 0.5, "recall": 1.0, "tp": 1}, "Spatial Reasoning Error": {"f1": 1.0, "fn": 0, "fp": 0, "precision": 1.0, "recall": 1.0, "tp": 1}, "Text Matching Bias": {"f1": 1.0, "fn": 0, "fp": 0, "precision": 1.0, "recall": 1.0, "tp": 1}}, "primary": 0.7381, "primary_metric": "macro_f1"}, "holdout": {"exact_match_rate": 0.4, "macro_f1": 0.3333, "mean_jaccard": 0.4, "micro_f1": 0.5, "n": 5, "per_leaf": {"Action Looping (Repetition)": {"f1": 1.0, "fn": 0, "fp": 0, "precision": 1.0, "recall": 1.0, "tp": 1}, "Click Region Error": {"f1": 0.0, "fn": 1, "fp": 0, "precision": 0.0, "recall": 0.0, "tp": 0}, "Goal Hallucination": {"f1": 0.0, "fn": 1, "fp": 0, "precision": 0.0, "recall": 0.0, "tp": 0}, "Hidden Operation Blindness": {"f1": 0.0, "fn": 1, "fp": 0, "precision": 0.0, "recall": 0.0, "tp": 0}, "Location Hallucination": {"f1": 1.0, "fn": 0, "fp": 0, "precision": 1.0, "recall": 1.0, "tp": 1}, "Long-Horizon Memory Failure": {"f1": 0.0, "fn": 0, "fp": 1, "precision": 0.0, "recall": 0.0, "tp": 0}, "Spatial Reasoning Error": {"f1": 0.0, "fn": 0, "fp": 0, "precision": 0.0, "recall": 0.0, "tp": 0}, "Text Matching Bias": {"f1": 0.0, "fn": 0, "fp": 0, "precision": 0.0, "recall": 0.0, "tp": 0}}, "primary": 0.3333, "primary_metric": "macro_f1"}}, "timestamp": "2026-08-10T23:34:05Z", "verdict": "discarded"}
{"candidate_hash": "772a06ba3967546b", "candidate_name": "grid-0019[far_threshold_px=80.0,long_horizon_threshold_ratio=0.7,min_repeat=2,near_margin_ratio=3.0]", "cost_usd": 0.0, "delta_vs_best": -0.0905, "eval_set_hash": "20c83ed3cbce3d37", "executor": "detector", "experiment_id": "exp-0020", "notes": "tier1.py defaults + judge protocol v1", "parent_hash": "308d125283a522f3", "primary_calibration": 0.7381, "primary_holdout": 0.3333, "run_id": "det-grid-001", "scores": {"calibration": {"exact_match_rate": 0.6667, "macro_f1": 0.7381, "mean_jaccard": 0.7083, "micro_f1": 0.7826, "n": 12, "per_leaf": {"Action Looping (Repetition)": {"f1": 1.0, "fn": 0, "fp": 0, "precision": 1.0, "recall": 1.0, "tp": 4}, "Click Region Error": {"f1": 0.5, "fn": 2, "fp": 0, "precision": 1.0, "recall": 0.3333, "tp": 1}, "Goal Hallucination": {"f1": 0.0, "fn": 2, "fp": 0, "precision": 0.0, "recall": 0.0, "tp": 0}, "Hidden Operation Blindness": {"f1": 0.0, "fn": 0, "fp": 0, "precision": 0.0, "recall": 0.0, "tp": 0}, "Location Hallucination": {"f1": 1.0, "fn": 0, "fp": 0, "precision": 1.0, "recall": 1.0, "tp": 1}, "Long-Horizon Memory Failure": {"f1": 0.6667, "fn": 0, "fp": 1, "precision": 0.5, "recall": 1.0, "tp": 1}, "Spatial Reasoning Error": {"f1": 1.0, "fn": 0, "fp": 0, "precision": 1.0, "recall": 1.0, "tp": 1}, "Text Matching Bias": {"f1": 1.0, "fn": 0, "fp": 0, "precision": 1.0, "recall": 1.0, "tp": 1}}, "primary": 0.7381, "primary_metric": "macro_f1"}, "holdout": {"exact_match_rate": 0.4, "macro_f1": 0.3333, "mean_jaccard": 0.4, "micro_f1": 0.5, "n": 5, "per_leaf": {"Action Looping (Repetition)": {"f1": 1.0, "fn": 0, "fp": 0, "precision": 1.0, "recall": 1.0, "tp": 1}, "Click Region Error": {"f1": 0.0, "fn": 1, "fp": 0, "precision": 0.0, "recall": 0.0, "tp": 0}, "Goal Hallucination": {"f1": 0.0, "fn": 1, "fp": 0, "precision": 0.0, "recall": 0.0, "tp": 0}, "Hidden Operation Blindness": {"f1": 0.0, "fn": 1, "fp": 0, "precision": 0.0, "recall": 0.0, "tp": 0}, "Location Hallucination": {"f1": 1.0, "fn": 0, "fp": 0, "precision": 1.0, "recall": 1.0, "tp": 1}, "Long-Horizon Memory Failure": {"f1": 0.0, "fn": 0, "fp": 1, "precision": 0.0, "recall": 0.0, "tp": 0}, "Spatial Reasoning Error": {"f1": 0.0, "fn": 0, "fp": 0, "precision": 0.0, "recall": 0.0, "tp": 0}, "Text Matching Bias": {"f1": 0.0, "fn": 0, "fp": 0, "precision": 0.0, "recall": 0.0, "tp": 0}}, "primary": 0.3333, "primary_metric": "macro_f1"}}, "timestamp": "2026-08-10T23:34:05Z", "verdict": "discarded"}
{"candidate_hash": "917c4cd838dcf689", "candidate_name": "grid-0020[far_threshold_px=80.0,long_horizon_threshold_ratio=0.7,min_repeat=2,near_margin_ratio=5.0]", "cost_usd": 0.0, "delta_vs_best": -0.0476, "eval_set_hash": "20c83ed3cbce3d37", "executor": "detector", "experiment_id": "exp-0021", "notes": "tier1.py defaults + judge protocol v1", "parent_hash": "308d125283a522f3", "primary_calibration": 0.781, "primary_holdout": 0.5, "run_id": "det-grid-001", "scores": {"calibration": {"exact_match_rate": 0.75, "macro_f1": 0.781, "mean_jaccard": 0.7917, "micro_f1": 0.8333, "n": 12, "per_leaf": {"Action Looping (Repetition)": {"f1": 1.0, "fn": 0, "fp": 0, "precision": 1.0, "recall": 1.0, "tp": 4}, "Click Region Error": {"f1": 0.8, "fn": 1, "fp": 0, "precision": 1.0, "recall": 0.6667, "tp": 2}, "Goal Hallucination": {"f1": 0.0, "fn": 2, "fp": 0, "precision": 0.0, "recall": 0.0, "tp": 0}, "Hidden Operation Blindness": {"f1": 0.0, "fn": 0, "fp": 0, "precision": 0.0, "recall": 0.0, "tp": 0}, "Location Hallucination": {"f1": 1.0, "fn": 0, "fp": 0, "precision": 1.0, "recall": 1.0, "tp": 1}, "Long-Horizon Memory Failure": {"f1": 0.6667, "fn": 0, "fp": 1, "precision": 0.5, "recall": 1.0, "tp": 1}, "Spatial Reasoning Error": {"f1": 1.0, "fn": 0, "fp": 0, "precision": 1.0, "recall": 1.0, "tp": 1}, "Text Matching Bias": {"f1": 1.0, "fn": 0, "fp": 0, "precision": 1.0, "recall": 1.0, "tp": 1}}, "primary": 0.781, "primary_metric": "macro_f1"}, "holdout": {"exact_match_rate": 0.6, "macro_f1": 0.5, "mean_jaccard": 0.6, "micro_f1": 0.6667, "n": 5, "per_leaf": {"Action Looping (Repetition)": {"f1": 1.0, "fn": 0, "fp": 0, "precision": 1.0, "recall": 1.0, "tp": 1}, "Click Region Error": {"f1": 1.0, "fn": 0, "fp": 0, "precision": 1.0, "recall": 1.0, "tp": 1}, "Goal Hallucination": {"f1": 0.0, "fn": 1, "fp": 0, "precision": 0.0, "recall": 0.0, "tp": 0}, "Hidden Operation Blindness": {"f1": 0.0, "fn": 1, "fp": 0, "precision": 0.0, "recall": 0.0, "tp": 0}, "Location Hallucination": {"f1": 1.0, "fn": 0, "fp": 0, "precision": 1.0, "recall": 1.0, "tp": 1}, "Long-Horizon Memory Failure": {"f1": 0.0, "fn": 0, "fp": 1, "precision": 0.0, "recall": 0.0, "tp": 0}, "Spatial Reasoning Error": {"f1": 0.0, "fn": 0, "fp": 0, "precision": 0.0, "recall": 0.0, "tp": 0}, "Text Matching Bias": {"f1": 0.0, "fn": 0, "fp": 0, "precision": 0.0, "recall": 0.0, "tp": 0}}, "primary": 0.5, "primary_metric": "macro_f1"}}, "timestamp": "2026-08-10T23:34:05Z", "verdict": "discarded"}
{"candidate_hash": "37e64c901548e738", "candidate_name": "grid-0021[far_threshold_px=80.0,long_horizon_threshold_ratio=0.7,min_repeat=3,near_margin_ratio=1.5]", "cost_usd": 0.0, "delta_vs_best": -0.1109, "eval_set_hash": "20c83ed3cbce3d37", "executor": "detector", "experiment_id": "exp-0022", "notes": "tier1.py defaults + judge protocol v1", "parent_hash": "308d125283a522f3", "primary_calibration": 0.7177, "primary_holdout": 0.1667, "run_id": "det-grid-001", "scores": {"calibration": {"exact_match_rate": 0.5833, "macro_f1": 0.7177, "mean_jaccard": 0.625, "micro_f1": 0.7273, "n": 12, "per_leaf": {"Action Looping (Repetition)": {"f1": 0.8571, "fn": 1, "fp": 0, "precision": 1.0, "recall": 0.75, "tp": 3}, "Click Region Error": {"f1": 0.5, "fn": 2, "fp": 0, "precision": 1.0, "recall": 0.3333, "tp": 1}, "Goal Hallucination": {"f1": 0.0, "fn": 2, "fp": 0, "precision": 0.0, "recall": 0.0, "tp": 0}, "Hidden Operation Blindness": {"f1": 0.0, "fn": 0, "fp": 0, "precision": 0.0, "recall": 0.0, "tp": 0}, "Location Hallucination": {"f1": 1.0, "fn": 0, "fp": 0, "precision": 1.0, "recall": 1.0, "tp": 1}, "Long-Horizon Memory Failure": {"f1": 0.6667, "fn": 0, "fp": 1, "precision": 0.5, "recall": 1.0, "tp": 1}, "Spatial Reasoning Error": {"f1": 1.0, "fn": 0, "fp": 0, "precision": 1.0, "recall": 1.0, "tp": 1}, "Text Matching Bias": {"f1": 1.0, "fn": 0, "fp": 0, "precision": 1.0, "recall": 1.0, "tp": 1}}, "primary": 0.7177, "primary_metric": "macro_f1"}, "holdout": {"exact_match_rate": 0.2, "macro_f1": 0.1667, "mean_jaccard": 0.2, "micro_f1": 0.2857, "n": 5, "per_leaf": {"Action Looping (Repetition)": {"f1": 0.0, "fn": 1, "fp": 0, "precision": 0.0, "recall": 0.0, "tp": 0}, "Click Region Error": {"f1": 0.0, "fn": 1, "fp": 0, "precision": 0.0, "recall": 0.0, "tp": 0}, "Goal Hallucination": {"f1": 0.0, "fn": 1, "fp": 0, "precision": 0.0, "recall": 0.0, "tp": 0}, "Hidden Operation Blindness": {"f1": 0.0, "fn": 1, "fp": 0, "precision": 0.0, "recall": 0.0, "tp": 0}, "Location Hallucination": {"f1": 1.0, "fn": 0, "fp": 0, "precision": 1.0, "recall": 1.0, "tp": 1}, "Long-Horizon Memory Failure": {"f1": 0.0, "fn": 0, "fp": 1, "precision": 0.0, "recall": 0.0, "tp": 0}, "Spatial Reasoning Error": {"f1": 0.0, "fn": 0, "fp": 0, "precision": 0.0, "recall": 0.0, "tp": 0}, "Text Matching Bias": {"f1": 0.0, "fn": 0, "fp": 0, "precision": 0.0, "recall": 0.0, "tp": 0}}, "primary": 0.1667, "primary_metric": "macro_f1"}}, "timestamp": "2026-08-10T23:34:05Z", "verdict": "discarded"}
{"candidate_hash": "64359628ad976e7b", "candidate_name": "grid-0022[far_threshold_px=80.0,long_horizon_threshold_ratio=0.7,min_repeat=3,near_margin_ratio=3.0]", "cost_usd": 0.0, "delta_vs_best": -0.1109, "eval_set_hash": "20c83ed3cbce3d37", "executor": "detector", "experiment_id": "exp-0023", "notes": "tier1.py defaults + judge protocol v1", "parent_hash": "308d125283a522f3", "primary_calibration": 0.7177, "primary_holdout": 0.1667, "run_id": "det-grid-001", "scores": {"calibration": {"exact_match_rate": 0.5833, "macro_f1": 0.7177, "mean_jaccard": 0.625, "micro_f1": 0.7273, "n": 12, "per_leaf": {"Action Looping (Repetition)": {"f1": 0.8571, "fn": 1, "fp": 0, "precision": 1.0, "recall": 0.75, "tp": 3}, "Click Region Error": {"f1": 0.5, "fn": 2, "fp": 0, "precision": 1.0, "recall": 0.3333, "tp": 1}, "Goal Hallucination": {"f1": 0.0, "fn": 2, "fp": 0, "precision": 0.0, "recall": 0.0, "tp": 0}, "Hidden Operation Blindness": {"f1": 0.0, "fn": 0, "fp": 0, "precision": 0.0, "recall": 0.0, "tp": 0}, "Location Hallucination": {"f1": 1.0, "fn": 0, "fp": 0, "precision": 1.0, "recall": 1.0, "tp": 1}, "Long-Horizon Memory Failure": {"f1": 0.6667, "fn": 0, "fp": 1, "precision": 0.5, "recall": 1.0, "tp": 1}, "Spatial Reasoning Error": {"f1": 1.0, "fn": 0, "fp": 0, "precision": 1.0, "recall": 1.0, "tp": 1}, "Text Matching Bias": {"f1": 1.0, "fn": 0, "fp": 0, "precision": 1.0, "recall": 1.0, "tp": 1}}, "primary": 0.7177, "primary_metric": "macro_f1"}, "holdout": {"exact_match_rate": 0.2, "macro_f1": 0.1667, "mean_jaccard": 0.2, "micro_f1": 0.2857, "n": 5, "per_leaf": {"Action Looping (Repetition)": {"f1": 0.0, "fn": 1, "fp": 0, "precision": 0.0, "recall": 0.0, "tp": 0}, "Click Region Error": {"f1": 0.0, "fn": 1, "fp": 0, "precision": 0.0, "recall": 0.0, "tp": 0}, "Goal Hallucination": {"f1": 0.0, "fn": 1, "fp": 0, "precision": 0.0, "recall": 0.0, "tp": 0}, "Hidden Operation Blindness": {"f1": 0.0, "fn": 1, "fp": 0, "precision": 0.0, "recall": 0.0, "tp": 0}, "Location Hallucination": {"f1": 1.0, "fn": 0, "fp": 0, "precision": 1.0, "recall": 1.0, "tp": 1}, "Long-Horizon Memory Failure": {"f1": 0.0, "fn": 0, "fp": 1, "precision": 0.0, "recall": 0.0, "tp": 0}, "Spatial Reasoning Error": {"f1": 0.0, "fn": 0, "fp": 0, "precision": 0.0, "recall": 0.0, "tp": 0}, "Text Matching Bias": {"f1": 0.0, "fn": 0, "fp": 0, "precision": 0.0, "recall": 0.0, "tp": 0}}, "primary": 0.1667, "primary_metric": "macro_f1"}}, "timestamp": "2026-08-10T23:34:05Z", "verdict": "discarded"}
