{"candidate_hash": "d75841c81eb87763", "candidate_name": "grid-0039[far_threshold_px=120.0,long_horizon_threshold_ratio=0.7,min_repeat=3,near_margin_ratio=1.5]", "cost_usd": 0.0, "delta_vs_best": -0.1109, "eval_set_hash": "20c83ed3cbce3d37", "executor": "detector", "experiment_id": "exp-0040", "notes": "tier1.py defaults + judge protocol v1", "parent_hash": "308d125283a522f3", "primary_calibration": 0.7177, "primary_holdout": 0.1667, "run_id": "det-grid-001", "scores": {"calibration": {"exact_match_rate": 0.5833, "macro_f1": 0.7177, "mean_jaccard": 0.625, "micro_f1": 0.7273, "n": 12, "per_leaf": {"Action Looping (Repetition)": {"f1": 0.8571, "fn": 1, "fp": 0, "precision": 1.0, "recall": 0.75, "tp": 3}, "Click Region Error": {"f1": 0.5, "fn": 2, "fp": 0, "precision": 1.0, "recall": 0.3333, "tp": 1}, "Goal Hallucination": {"f1": 0.0, "fn": 2, "fp": 0, "precision": 0.0, "recall": 0.0, "tp": 0}, "Hidden Operation Blindness": {"f1": 0.0, "fn": 0, "fp": 0, "precision": 0.0, "recall": 0.0, "tp": 0}, "Location Hallucination": {"f1": 1.0, "fn": 0, "fp": 0, "precision": 1.0, "recall": 1.0, "tp": 1}, "Long-Horizon Memory Failure": {"f1": 0.6667, "fn": 0, "fp": 1, "precision": 0.5, "recall": 1.0, "tp": 1}, "Spatial Reasoning Error": {"f1": 1.0, "fn": 0, "fp": 0, "precision": 1.0, "recall": 1.0, "tp": 1}, "Text Matching Bias": {"f1": 1.0, "fn": 0, "fp": 0, "precision": 1.0, "recall": 1.0, "tp": 1}}, "primary": 0.7177, "primary_metric": "macro_f1"}, "holdout": {"exact_match_rate": 0.2, "macro_f1": 0.1667, "mean_jaccard": 0.2, "micro_f1": 0.2857, "n": 5, "per_leaf": {"Action Looping (Repetition)": {"f1": 0.0, "fn": 1, "fp": 0, "precision": 0.0, "recall": 0.0, "tp": 0}, "Click Region Error": {"f1": 0.0, "fn": 1, "fp": 0, "precision": 0.0, "recall": 0.0, "tp": 0}, "Goal Hallucination": {"f1": 0.0, "fn": 1, "fp": 0, "precision": 0.0, "recall": 0.0, "tp": 0}, "Hidden Operation Blindness": {"f1": 0.0, "fn": 1, "fp": 0, "precision": 0.0, "recall": 0.0, "tp": 0}, "Location Hallucination": {"f1": 1.0, "fn": 0, "fp": 0, "precision": 1.0, "recall": 1.0, "tp": 1}, "Long-Horizon Memory Failure": {"f1": 0.0, "fn": 0, "fp": 1, "precision": 0.0, "recall": 0.0, "tp": 0}, "Spatial Reasoning Error": {"f1": 0.0, "fn": 0, "fp": 0, "precision": 0.0, "recall": 0.0, "tp": 0}, "Text Matching Bias": {"f1": 0.0, "fn": 0, "fp": 0, "precision": 0.0, "recall": 0.0, "tp": 0}}, "primary": 0.1667, "primary_metric": "macro_f1"}}, "timestamp": "2026-08-10T23:34:05Z", "verdict": "discarded"}
{"candidate_hash": "5fd99086e9152a8f", "candidate_name": "grid-0040[far_threshold_px=120.0,long_horizon_threshold_ratio=0.7,min_repeat=3,near_margin_ratio=3.0]", "cost_usd": 0.0, "delta_vs_best": -0.1109, "eval_set_hash": "20c83ed3cbce3d37", "executor": "detector", "experiment_id": "exp-0041", "notes": "tier1.py defaults + judge protocol v1", "parent_hash": "308d125283a522f3", "primary_calibration": 0.7177, "primary_holdout": 0.1667, "run_id": "det-grid-001", "scores": {"calibration": {"exact_match_rate": 0.5833, "macro_f1": 0.7177, "mean_jaccard": 0.625, "micro_f1": 0.7273, "n": 12, "per_leaf": {"Action Looping (Repetition)": {"f1": 0.8571, "fn": 1, "fp": 0, "precision": 1.0, "recall": 0.75, "tp": 3}, "Click Region Error": {"f1": 0.5, "fn": 2, "fp": 0, "precision": 1.0, "recall": 0.3333, "tp": 1}, "Goal Hallucination": {"f1": 0.0, "fn": 2, "fp": 0, "precision": 0.0, "recall": 0.0, "tp": 0}, "Hidden Operation Blindness": {"f1": 0.0, "fn": 0, "fp": 0, "precision": 0.0, "recall": 0.0, "tp": 0}, "Location Hallucination": {"f1": 1.0, "fn": 0, "fp": 0, "precision": 1.0, "recall": 1.0, "tp": 1}, "Long-Horizon Memory Failure": {"f1": 0.6667, "fn": 0, "fp": 1, "precision": 0.5, "recall": 1.0, "tp": 1}, "Spatial Reasoning Error": {"f1": 1.0, "fn": 0, "fp": 0, "precision": 1.0, "recall": 1.0, "tp": 1}, "Text Matching Bias": {"f1": 1.0, "fn": 0, "fp": 0, "precision": 1.0, "recall": 1.0, "tp": 1}}, "primary": 0.7177, "primary_metric": "macro_f1"}, "holdout": {"exact_match_rate": 0.2, "macro_f1": 0.1667, "mean_jaccard": 0.2, "micro_f1": 0.2857, "n": 5, "per_leaf": {"Action Looping (Repetition)": {"f1": 0.0, "fn": 1, "fp": 0, "precision": 0.0, "recall": 0.0, "tp": 0}, "Click Region Error": {"f1": 0.0, "fn": 1, "fp": 0, "precision": 0.0, "recall": 0.0, "tp": 0}, "Goal Hallucination": {"f1": 0.0, "fn": 1, "fp": 0, "precision": 0.0, "recall": 0.0, "tp": 0}, "Hidden Operation Blindness": {"f1": 0.0, "fn": 1, "fp": 0, "precision": 0.0, "recall": 0.0, "tp": 0}, "Location Hallucination": {"f1": 1.0, "fn": 0, "fp": 0, "precision": 1.0, "recall": 1.0, "tp": 1}, "Long-Horizon Memory Failure": {"f1": 0.0, "fn": 0, "fp": 1, "precision": 0.0, "recall": 0.0, "tp": 0}, "Spatial Reasoning Error": {"f1": 0.0, "fn": 0, "fp": 0, "precision": 0.0, "recall": 0.0, "tp": 0}, "Text Matching Bias": {"f1": 0.0, "fn": 0, "fp": 0, "precision": 0.0, "recall": 0.0, "tp": 0}}, "primary": 0.1667, "primary_metric": "macro_f1"}}, "timestamp": "2026-08-10T23:34:05Z", "verdict": "discarded"}
{"candidate_hash": "31e03fb082ca6041", "candidate_name": "grid-0041[far_threshold_px=120.0,long_horizon_threshold_ratio=0.7,min_repeat=3,near_margin_ratio=5.0]", "cost_usd": 0.0, "delta_vs_best": -0.068, "eval_set_hash": "20c83ed3cbce3d37", "executor": "detector", "experiment_id": "exp-0042", "notes": "tier1.py defaults + judge protocol v1", "parent_hash": "308d125283a522f3", "primary_calibration": 0.7605, "primary_holdout": 0.3333, "run_id": "det-grid-001", "scores": {"calibration": {"exact_match_rate": 0.6667, "macro_f1": 0.7605, "mean_jaccard": 0.7083, "micro_f1": 0.7826, "n": 12, "per_leaf": {"Action Looping (Repetition)": {"f1": 0.8571, "fn": 1, "fp": 0, "precision": 1.0, "recall": 0.75, "tp": 3}, "Click Region Error": {"f1": 0.8, "fn": 1, "fp": 0, "precision": 1.0, "recall": 0.6667, "tp": 2}, "Goal Hallucination": {"f1": 0.0, "fn": 2, "fp": 0, "precision": 0.0, "recall": 0.0, "tp": 0}, "Hidden Operation Blindness": {"f1": 0.0, "fn": 0, "fp": 0, "precision": 0.0, "recall": 0.0, "tp": 0}, "Location Hallucination": {"f1": 1.0, "fn": 0, "fp": 0, "precision": 1.0, "recall": 1.0, "tp": 1}, "Long-Horizon Memory Failure": {"f1": 0.6667, "fn": 0, "fp": 1, "precision": 0.5, "recall": 1.0, "tp": 1}, "Spatial Reasoning Error": {"f1": 1.0, "fn": 0, "fp": 0, "precision": 1.0, "recall": 1.0, "tp": 1}, "Text Matching Bias": {"f1": 1.0, "fn": 0, "fp": 0, "precision": 1.0, "recall": 1.0, "tp": 1}}, "primary": 0.7605, "primary_metric": "macro_f1"}, "holdout": {"exact_match_rate": 0.4, "macro_f1": 0.3333, "mean_jaccard": 0.4, "micro_f1": 0.5, "n": 5, "per_leaf": {"Action Looping (Repetition)": {"f1": 0.0, "fn": 1, "fp": 0, "precision": 0.0, "recall": 0.0, "tp": 0}, "Click Region Error": {"f1": 1.0, "fn": 0, "fp": 0, "precision": 1.0, "recall": 1.0, "tp": 1}, "Goal Hallucination": {"f1": 0.0, "fn": 1, "fp": 0, "precision": 0.0, "recall": 0.0, "tp": 0}, "Hidden Operation Blindness": {"f1": 0.0, "fn": 1, "fp": 0, "precision": 0.0, "recall": 0.0, "tp": 0}, "Location Hallucination": {"f1": 1.0, "fn": 0, "fp": 0, "precision": 1.0, "recall": 1.0, "tp": 1}, "Long-Horizon Memory Failure": {"f1": 0.0, "fn": 0, "fp": 1, "precision": 0.0, "recall": 0.0, "tp": 0}, "Spatial Reasoning Error": {"f1": 0.0, "fn": 0, "fp": 0, "precision": 0.0, "recall": 0.0, "tp": 0}, "Text Matching Bias": {"f1": 0.0, "fn": 0, "fp": 0, "precision": 0.0, "recall": 0.0, "tp": 0}}, "primary": 0.3333, "primary_metric": "macro_f1"}}, "timestamp": "2026-08-10T23:34:05Z", "verdict": "discarded"}
{"candidate_hash": "011d55e4442d90d9", "candidate_name": "grid-0042[far_threshold_px=120.0,long_horizon_threshold_ratio=0.85,min_repeat=2,near_margin_ratio=1.5]", "cost_usd": 0.0, "delta_vs_best": -0.0429, "eval_set_hash": "20c83ed3cbce3d37", "executor": "detector", "experiment_id": "exp-0043", "notes": "tier1.py defaults + judge protocol v1", "parent_hash": "308d125283a522f3", "primary_calibration": 0.7857, "primary_holdout": 0.4, "run_id": "det-grid-001", "scores": {"calibration": {"exact_match_rate": 0.6667, "macro_f1": 0.7857, "mean_jaccard": 0.7083, "micro_f1": 0.8182, "n": 12, "per_leaf": {"Action Looping (Repetition)": {"f1": 1.0, "fn": 0, "fp": 0, "precision": 1.0, "recall": 1.0, "tp": 4}, "Click Region Error": {"f1": 0.5, "fn": 2, "fp": 0, "precision": 1.0, "recall": 0.3333, "tp": 1}, "Goal Hallucination": {"f1": 0.0, "fn": 2, "fp": 0, "precision": 0.0, "recall": 0.0, "tp": 0}, "Hidden Operation Blindness": {"f1": 0.0, "fn": 0, "fp": 0, "precision": 0.0, "recall": 0.0, "tp": 0}, "Location Hallucination": {"f1": 1.0, "fn": 0, "fp": 0, "precision": 1.0, "recall": 1.0, "tp": 1}, "Long-Horizon Memory Failure": {"f1": 1.0, "fn": 0, "fp": 0, "precision": 1.0, "recall": 1.0, "tp": 1}, "Spatial Reasoning Error": {"f1": 1.0, "fn": 0, "fp": 0, "precision": 1.0, "recall": 1.0, "tp": 1}, "Text Matching Bias": {"f1": 1.0, "fn": 0, "fp": 0, "precision": 1.0, "recall": 1.0, "tp": 1}}, "primary": 0.7857, "primary_metric": "macro_f1"}, "holdout": {"exact_match_rate": 0.4, "macro_f1": 0.4, "mean_jaccard": 0.4, "micro_f1": 0.5714, "n": 5, "per_leaf": {"Action Looping (Repetition)": {"f1": 1.0, "fn": 0, "fp": 0, "precision": 1.0, "recall": 1.0, "tp": 1}, "Click Region Error": {"f1": 0.0, "fn": 1, "fp": 0, "precision": 0.0, "recall": 0.0, "tp": 0}, "Goal Hallucination": {"f1": 0.0, "fn": 1, "fp": 0, "precision": 0.0, "recall": 0.0, "tp": 0}, "Hidden Operation Blindness": {"f1": 0.0, "fn": 1, "fp": 0, "precision": 0.0, "recall": 0.0, "tp": 0}, "Location Hallucination": {"f1": 1.0, "fn": 0, "fp": 0, "precision": 1.0, "recall": 1.0, "tp": 1}, "Long-Horizon Memory Failure": {"f1": 0.0, "fn": 0, "fp": 0, "precision": 0.0, "recall": 0.0, "tp": 0}, "Spatial Reasoning Error": {"f1": 0.0, "fn": 0, "fp": 0, "precision": 0.0, "recall": 0.0, "tp": 0}, "Text Matching Bias": {"f1": 0.0, "fn": 0, "fp": 0, "precision": 0.0, "recall": 0.0, "tp": 0}}, "primary": 0.4, "primary_metric": "macro_f1"}}, "timestamp": "2026-08-10T23:34:05Z", "verdict": "discarded"}
{"candidate_hash": "cf115ff9acb78670", "candidate_name": "grid-0043[far_threshold_px=120.0,long_horizon_threshold_ratio=0.85,min_repeat=2,near_margin_ratio=3.0]", "cost_usd": 0.0, "delta_vs_best": -0.0429, "eval_set_hash": "20c83ed3cbce3d37", "executor": "detector", "experiment_id": "exp-0044", "notes": "tier1.py defaults + judge protocol v1", "parent_hash": "308d125283a522f3", "primary_calibration": 0.7857, "primary_holdout": 0.4, "run_id": "det-grid-001", "scores": {"calibration": {"exact_match_rate": 0.6667, "macro_f1": 0.7857, "mean_jaccard": 0.7083, "micro_f1": 0.8182, "n": 12, "per_leaf": {"Action Looping (Repetition)": {"f1": 1.0, "fn": 0, "fp": 0, "precision": 1.0, "recall": 1.0, "tp": 4}, "Click Region Error": {"f1": 0.5, "fn": 2, "fp": 0, "precision": 1.0, "recall": 0.3333, "tp": 1}, "Goal Hallucination": {"f1": 0.0, "fn": 2, "fp": 0, "precision": 0.0, "recall": 0.0, "tp": 0}, "Hidden Operation Blindness": {"f1": 0.0, "fn": 0, "fp": 0, "precision": 0.0, "recall": 0.0, "tp": 0}, "Location Hallucination": {"f1": 1.0, "fn": 0, "fp": 0, "precision": 1.0, "recall": 1.0, "tp": 1}, "Long-Horizon Memory Failure": {"f1": 1.0, "fn": 0, "fp": 0, "precision": 1.0, "recall": 1.0, "tp": 1}, "Spatial Reasoning Error": {"f1": 1.0, "fn": 0, "fp": 0, "precision": 1.0, "recall": 1.0, "tp": 1}, "Text Matching Bias": {"f1": 1.0, "fn": 0, "fp": 0, "precision": 1.0, "recall": 1.0, "tp": 1}}, "primary": 0.7857, "primary_metric": "macro_f1"}, "holdout": {"exact_match_rate": 0.4, "macro_f1": 0.4, "mean_jaccard": 0.4, "micro_f1": 0.5714, "n": 5, "per_leaf": {"Action Looping (Repetition)": {"f1": 1.0, "fn": 0, "fp": 0, "precision": 1.0, "recall": 1.0, "tp": 1}, "Click Region Error": {"f1": 0.0, "fn": 1, "fp": 0, "precision": 0.0, "recall": 0.0, "tp": 0}, "Goal Hallucination": {"f1": 0.0, "fn": 1, "fp": 0, "precision": 0.0, "recall": 0.0, "tp": 0}, "Hidden Operation Blindness": {"f1": 0.0, "fn": 1, "fp": 0, "precision": 0.0, "recall": 0.0, "tp": 0}, "Location Hallucination": {"f1": 1.0, "fn": 0, "fp": 0, "precision": 1.0, "recall": 1.0, "tp": 1}, "Long-Horizon Memory Failure": {"f1": 0.0, "fn": 0, "fp": 0, "precision": 0.0, "recall": 0.0, "tp": 0}, "Spatial Reasoning Error": {"f1": 0.0, "fn": 0, "fp": 0, "precision": 0.0, "recall": 0.0, "tp": 0}, "Text Matching Bias": {"f1": 0.0, "fn": 0, "fp": 0, "precision": 0.0, "recall": 0.0, "tp": 0}}, "primary": 0.4, "primary_metric": "macro_f1"}}, "timestamp": "2026-08-10T23:34:05Z", "verdict": "discarded"}
{"candidate_hash": "15750efb4eea67b8", "candidate_name": "grid-0044[far_threshold_px=120.0,long_horizon_threshold_ratio=0.85,min_repeat=2,near_margin_ratio=5.0]", "cost_usd": 0.0, "delta_vs_best": 0.0, "eval_set_hash": "20c83ed3cbce3d37", "executor": "detector", "experiment_id": "exp-0045", "notes": "tier1.py defaults + judge protocol v1", "parent_hash": "308d125283a522f3", "primary_calibration": 0.8286, "primary_holdout": 0.6, "run_id": "det-grid-001", "scores": {"calibration": {"exact_match_rate": 0.75, "macro_f1": 0.8286, "mean_jaccard": 0.7917, "micro_f1": 0.8696, "n": 12, "per_leaf": {"Action Looping (Repetition)": {"f1": 1.0, "fn": 0, "fp": 0, "precision": 1.0, "recall": 1.0, "tp": 4}, "Click Region Error": {"f1": 0.8, "fn": 1, "fp": 0, "precision": 1.0, "recall": 0.6667, "tp": 2}, "Goal Hallucination": {"f1": 0.0, "fn": 2, "fp": 0, "precision": 0.0, "recall": 0.0, "tp": 0}, "Hidden Operation Blindness": {"f1": 0.0, "fn": 0, "fp": 0, "precision": 0.0, "recall": 0.0, "tp": 0}, "Location Hallucination": {"f1": 1.0, "fn": 0, "fp": 0, "precision": 1.0, "recall": 1.0, "tp": 1}, "Long-Horizon Memory Failure": {"f1": 1.0, "fn": 0, "fp": 0, "precision": 1.0, "recall": 1.0, "tp": 1}, "Spatial Reasoning Error": {"f1": 1.0, "fn": 0, "fp": 0, "precision": 1.0, "recall": 1.0, "tp": 1}, "Text Matching Bias": {"f1": 1.0, "fn": 0, "fp": 0, "precision": 1.0, "recall": 1.0, "tp": 1}}, "primary": 0.8286, "primary_metric": "macro_f1"}, "holdout": {"exact_match_rate": 0.6, "macro_f1": 0.6, "mean_jaccard": 0.6, "micro_f1": 0.75, "n": 5, "per_leaf": {"Action Looping (Repetition)": {"f1": 1.0, "fn": 0, "fp": 0, "precision": 1.0, "recall": 1.0, "tp": 1}, "Click Region Error": {"f1": 1.0, "fn": 0, "fp": 0, "precision": 1.0, "recall": 1.0, "tp": 1}, "Goal Hallucination": {"f1": 0.0, "fn": 1, "fp": 0, "precision": 0.0, "recall": 0.0, "tp": 0}, "Hidden Operation Blindness": {"f1": 0.0, "fn": 1, "fp": 0, "precision": 0.0, "recall": 0.0, "tp": 0}, "Location Hallucination": {"f1": 1.0, "fn": 0, "fp": 0, "precision": 1.0, "recall": 1.0, "tp": 1}, "Long-Horizon Memory Failure": {"f1": 0.0, "fn": 0, "fp": 0, "precision": 0.0, "recall": 0.0, "tp": 0}, "Spatial Reasoning Error": {"f1": 0.0, "fn": 0, "fp": 0, "precision": 0.0, "recall": 0.0, "tp": 0}, "Text Matching Bias": {"f1": 0.0, "fn": 0, "fp": 0, "precision": 0.0, "recall": 0.0, "tp": 0}}, "primary": 0.6, "primary_metric": "macro_f1"}}, "timestamp": "2026-08-10T23:34:05Z", "verdict": "discarded"}
{"candidate_hash": "ba7b5c56de5e2f28", "candidate_name": "grid-0045[far_threshold_px=120.0,long_horizon_threshold_ratio=0.85,min_repeat=3,near_margin_ratio=1.5]", "cost_usd": 0.0, "delta_vs_best": -0.0633, "eval_set_hash": "20c83ed3cbce3d37", "executor": "detector", "experiment_id": "exp-0046", "notes": "tier1.py defaults + judge protocol v1", "parent_hash": "308d125283a522f3", "primary_calibration": 0.7653, "primary_holdout": 0.2, "run_id": "det-grid-001", "scores": {"calibration": {"exact_match_rate": 0.5833, "macro_f1": 0.7653, "mean_jaccard": 0.625, "micro_f1": 0.7619, "n": 12, "per_leaf": {"Action Looping (Repetition)": {"f1": 0.8571, "fn": 1, "fp": 0, "precision": 1.0, "recall": 0.75, "tp": 3}, "Click Region Error": {"f1": 0.5, "fn": 2, "fp": 0, "precision": 1.0, "recall": 0.3333, "tp": 1}, "Goal Hallucination": {"f1": 0.0, "fn": 2, "fp": 0, "precision": 0.0, "recall": 0.0, "tp": 0}, "Hidden Operation Blindness": {"f1": 0.0, "fn": 0, "fp": 0, "precision": 0.0, "recall": 0.0, "tp": 0}, "Location Hallucination": {"f1": 1.0, "fn": 0, "fp": 0, "precision": 1.0, "recall": 1.0, "tp": 1}, "Long-Horizon Memory Failure": {"f1": 1.0, "fn": 0, "fp": 0, "precision": 1.0, "recall": 1.0, "tp": 1}, "Spatial Reasoning Error": {"f1": 1.0, "fn": 0, "fp": 0, "precision": 1.0, "recall": 1.0, "tp": 1}, "Text Matching Bias": {"f1": 1.0, "fn": 0, "fp": 0, "precision": 1.0, "recall": 1.0, "tp": 1}}, "primary": 0.7653, "primary_metric": "macro_f1"}, "holdout": {"exact_match_rate": 0.2, "macro_f1": 0.2, "mean_jaccard": 0.2, "micro_f1": 0.3333, "n": 5, "per_leaf": {"Action Looping (Repetition)": {"f1": 0.0, "fn": 1, "fp": 0, "precision": 0.0, "recall": 0.0, "tp": 0}, "Click Region Error": {"f1": 0.0, "fn": 1, "fp": 0, "precision": 0.0, "recall": 0.0, "tp": 0}, "Goal Hallucination": {"f1": 0.0, "fn": 1, "fp": 0, "precision": 0.0, "recall": 0.0, "tp": 0}, "Hidden Operation Blindness": {"f1": 0.0, "fn": 1, "fp": 0, "precision": 0.0, "recall": 0.0, "tp": 0}, "Location Hallucination": {"f1": 1.0, "fn": 0, "fp": 0, "precision": 1.0, "recall": 1.0, "tp": 1}, "Long-Horizon Memory Failure": {"f1": 0.0, "fn": 0, "fp": 0, "precision": 0.0, "recall": 0.0, "tp": 0}, "Spatial Reasoning Error": {"f1": 0.0, "fn": 0, "fp": 0, "precision": 0.0, "recall": 0.0, "tp": 0}, "Text Matching Bias": {"f1": 0.0, "fn": 0, "fp": 0, "precision": 0.0, "recall": 0.0, "tp": 0}}, "primary": 0.2, "primary_metric": "macro_f1"}}, "timestamp": "2026-08-10T23:34:05Z", "verdict": "discarded"}
{"candidate_hash": "7106a8d16c1945b2", "candidate_name": "grid-0046[far_threshold_px=120.0,long_horizon_threshold_ratio=0.85,min_repeat=3,near_margin_ratio=3.0]", "cost_usd": 0.0, "delta_vs_best": -0.0633, "eval_set_hash": "20c83ed3cbce3d37", "executor": "detector", "experiment_id": "exp-0047", "notes": "tier1.py defaults + judge protocol v1", "parent_hash": "308d125283a522f3", "primary_calibration": 0.7653, "primary_holdout": 0.2, "run_id": "det-grid-001", "scores": {"calibration": {"exact_match_rate": 0.5833, "macro_f1": 0.7653, "mean_jaccard": 0.625, "micro_f1": 0.7619, "n": 12, "per_leaf": {"Action Looping (Repetition)": {"f1": 0.8571, "fn": 1, "fp": 0, "precision": 1.0, "recall": 0.75, "tp": 3}, "Click Region Error": {"f1": 0.5, "fn": 2, "fp": 0, "precision": 1.0, "recall": 0.3333, "tp": 1}, "Goal Hallucination": {"f1": 0.0, "fn": 2, "fp": 0, "precision": 0.0, "recall": 0.0, "tp": 0}, "Hidden Operation Blindness": {"f1": 0.0, "fn": 0, "fp": 0, "precision": 0.0, "recall": 0.0, "tp": 0}, "Location Hallucination": {"f1": 1.0, "fn": 0, "fp": 0, "precision": 1.0, "recall": 1.0, "tp": 1}, "Long-Horizon Memory Failure": {"f1": 1.0, "fn": 0, "fp": 0, "precision": 1.0, "recall": 1.0, "tp": 1}, "Spatial Reasoning Error": {"f1": 1.0, "fn": 0, "fp": 0, "precision": 1.0, "recall": 1.0, "tp": 1}, "Text Matching Bias": {"f1": 1.0, "fn": 0, "fp": 0, "precision": 1.0, "recall": 1.0, "tp": 1}}, "primary": 0.7653, "primary_metric": "macro_f1"}, "holdout": {"exact_match_rate": 0.2, "macro_f1": 0.2, "mean_jaccard": 0.2, "micro_f1": 0.3333, "n": 5, "per_leaf": {"Action Looping (Repetition)": {"f1": 0.0, "fn": 1, "fp": 0, "precision": 0.0, "recall": 0.0, "tp": 0}, "Click Region Error": {"f1": 0.0, "fn": 1, "fp": 0, "precision": 0.0, "recall": 0.0, "tp": 0}, "Goal Hallucination": {"f1": 0.0, "fn": 1, "fp": 0, "precision": 0.0, "recall": 0.0, "tp": 0}, "Hidden Operation Blindness": {"f1": 0.0, "fn": 1, "fp": 0, "precision": 0.0, "recall": 0.0, "tp": 0}, "Location Hallucination": {"f1": 1.0, "fn": 0, "fp": 0, "precision": 1.0, "recall": 1.0, "tp": 1}, "Long-Horizon Memory Failure": {"f1": 0.0, "fn": 0, "fp": 0, "precision": 0.0, "recall": 0.0, "tp": 0}, "Spatial Reasoning Error": {"f1": 0.0, "fn": 0, "fp": 0, "precision": 0.0, "recall": 0.0, "tp": 0}, "Text Matching Bias": {"f1": 0.0, "fn": 0, "fp": 0, "precision": 0.0, "recall": 0.0, "tp": 0}}, "primary": 0.2, "primary_metric": "macro_f1"}}, "timestamp": "2026-08-10T23:34:05Z", "verdict": "discarded"}
