{"candidate_hash": "524ada17cced2833", "candidate_name": "grid-0023[far_threshold_px=80.0,long_horizon_threshold_ratio=0.7,min_repeat=3,near_margin_ratio=5.0]", "cost_usd": 0.0, "delta_vs_best": -0.068, "eval_set_hash": "20c83ed3cbce3d37", "executor": "detector", "experiment_id": "exp-0024", "notes": "tier1.py defaults + judge protocol v1", "parent_hash": "308d125283a522f3", "primary_calibration": 0.7605, "primary_holdout": 0.3333, "run_id": "det-grid-001", "scores": {"calibration": {"exact_match_rate": 0.6667, "macro_f1": 0.7605, "mean_jaccard": 0.7083, "micro_f1": 0.7826, "n": 12, "per_leaf": {"Action Looping (Repetition)": {"f1": 0.8571, "fn": 1, "fp": 0, "precision": 1.0, "recall": 0.75, "tp": 3}, "Click Region Error": {"f1": 0.8, "fn": 1, "fp": 0, "precision": 1.0, "recall": 0.6667, "tp": 2}, "Goal Hallucination": {"f1": 0.0, "fn": 2, "fp": 0, "precision": 0.0, "recall": 0.0, "tp": 0}, "Hidden Operation Blindness": {"f1": 0.0, "fn": 0, "fp": 0, "precision": 0.0, "recall": 0.0, "tp": 0}, "Location Hallucination": {"f1": 1.0, "fn": 0, "fp": 0, "precision": 1.0, "recall": 1.0, "tp": 1}, "Long-Horizon Memory Failure": {"f1": 0.6667, "fn": 0, "fp": 1, "precision": 0.5, "recall": 1.0, "tp": 1}, "Spatial Reasoning Error": {"f1": 1.0, "fn": 0, "fp": 0, "precision": 1.0, "recall": 1.0, "tp": 1}, "Text Matching Bias": {"f1": 1.0, "fn": 0, "fp": 0, "precision": 1.0, "recall": 1.0, "tp": 1}}, "primary": 0.7605, "primary_metric": "macro_f1"}, "holdout": {"exact_match_rate": 0.4, "macro_f1": 0.3333, "mean_jaccard": 0.4, "micro_f1": 0.5, "n": 5, "per_leaf": {"Action Looping (Repetition)": {"f1": 0.0, "fn": 1, "fp": 0, "precision": 0.0, "recall": 0.0, "tp": 0}, "Click Region Error": {"f1": 1.0, "fn": 0, "fp": 0, "precision": 1.0, "recall": 1.0, "tp": 1}, "Goal Hallucination": {"f1": 0.0, "fn": 1, "fp": 0, "precision": 0.0, "recall": 0.0, "tp": 0}, "Hidden Operation Blindness": {"f1": 0.0, "fn": 1, "fp": 0, "precision": 0.0, "recall": 0.0, "tp": 0}, "Location Hallucination": {"f1": 1.0, "fn": 0, "fp": 0, "precision": 1.0, "recall": 1.0, "tp": 1}, "Long-Horizon Memory Failure": {"f1": 0.0, "fn": 0, "fp": 1, "precision": 0.0, "recall": 0.0, "tp": 0}, "Spatial Reasoning Error": {"f1": 0.0, "fn": 0, "fp": 0, "precision": 0.0, "recall": 0.0, "tp": 0}, "Text Matching Bias": {"f1": 0.0, "fn": 0, "fp": 0, "precision": 0.0, "recall": 0.0, "tp": 0}}, "primary": 0.3333, "primary_metric": "macro_f1"}}, "timestamp": "2026-08-10T23:34:05Z", "verdict": "discarded"}
{"candidate_hash": "372f884faaa8b3f2", "candidate_name": "grid-0024[far_threshold_px=80.0,long_horizon_threshold_ratio=0.85,min_repeat=2,near_margin_ratio=1.5]", "cost_usd": 0.0, "delta_vs_best": -0.0429, "eval_set_hash": "20c83ed3cbce3d37", "executor": "detector", "experiment_id": "exp-0025", "notes": "tier1.py defaults + judge protocol v1", "parent_hash": "308d125283a522f3", "primary_calibration": 0.7857, "primary_holdout": 0.4, "run_id": "det-grid-001", "scores": {"calibration": {"exact_match_rate": 0.6667, "macro_f1": 0.7857, "mean_jaccard": 0.7083, "micro_f1": 0.8182, "n": 12, "per_leaf": {"Action Looping (Repetition)": {"f1": 1.0, "fn": 0, "fp": 0, "precision": 1.0, "recall": 1.0, "tp": 4}, "Click Region Error": {"f1": 0.5, "fn": 2, "fp": 0, "precision": 1.0, "recall": 0.3333, "tp": 1}, "Goal Hallucination": {"f1": 0.0, "fn": 2, "fp": 0, "precision": 0.0, "recall": 0.0, "tp": 0}, "Hidden Operation Blindness": {"f1": 0.0, "fn": 0, "fp": 0, "precision": 0.0, "recall": 0.0, "tp": 0}, "Location Hallucination": {"f1": 1.0, "fn": 0, "fp": 0, "precision": 1.0, "recall": 1.0, "tp": 1}, "Long-Horizon Memory Failure": {"f1": 1.0, "fn": 0, "fp": 0, "precision": 1.0, "recall": 1.0, "tp": 1}, "Spatial Reasoning Error": {"f1": 1.0, "fn": 0, "fp": 0, "precision": 1.0, "recall": 1.0, "tp": 1}, "Text Matching Bias": {"f1": 1.0, "fn": 0, "fp": 0, "precision": 1.0, "recall": 1.0, "tp": 1}}, "primary": 0.7857, "primary_metric": "macro_f1"}, "holdout": {"exact_match_rate": 0.4, "macro_f1": 0.4, "mean_jaccard": 0.4, "micro_f1": 0.5714, "n": 5, "per_leaf": {"Action Looping (Repetition)": {"f1": 1.0, "fn": 0, "fp": 0, "precision": 1.0, "recall": 1.0, "tp": 1}, "Click Region Error": {"f1": 0.0, "fn": 1, "fp": 0, "precision": 0.0, "recall": 0.0, "tp": 0}, "Goal Hallucination": {"f1": 0.0, "fn": 1, "fp": 0, "precision": 0.0, "recall": 0.0, "tp": 0}, "Hidden Operation Blindness": {"f1": 0.0, "fn": 1, "fp": 0, "precision": 0.0, "recall": 0.0, "tp": 0}, "Location Hallucination": {"f1": 1.0, "fn": 0, "fp": 0, "precision": 1.0, "recall": 1.0, "tp": 1}, "Long-Horizon Memory Failure": {"f1": 0.0, "fn": 0, "fp": 0, "precision": 0.0, "recall": 0.0, "tp": 0}, "Spatial Reasoning Error": {"f1": 0.0, "fn": 0, "fp": 0, "precision": 0.0, "recall": 0.0, "tp": 0}, "Text Matching Bias": {"f1": 0.0, "fn": 0, "fp": 0, "precision": 0.0, "recall": 0.0, "tp": 0}}, "primary": 0.4, "primary_metric": "macro_f1"}}, "timestamp": "2026-08-10T23:34:05Z", "verdict": "discarded"}
{"candidate_hash": "631bc29a190bf02d", "candidate_name": "grid-0025[far_threshold_px=80.0,long_horizon_threshold_ratio=0.85,min_repeat=2,near_margin_ratio=3.0]", "cost_usd": 0.0, "delta_vs_best": -0.0429, "eval_set_hash": "20c83ed3cbce3d37", "executor": "detector", "experiment_id": "exp-0026", "notes": "tier1.py defaults + judge protocol v1", "parent_hash": "308d125283a522f3", "primary_calibration": 0.7857, "primary_holdout": 0.4, "run_id": "det-grid-001", "scores": {"calibration": {"exact_match_rate": 0.6667, "macro_f1": 0.7857, "mean_jaccard": 0.7083, "micro_f1": 0.8182, "n": 12, "per_leaf": {"Action Looping (Repetition)": {"f1": 1.0, "fn": 0, "fp": 0, "precision": 1.0, "recall": 1.0, "tp": 4}, "Click Region Error": {"f1": 0.5, "fn": 2, "fp": 0, "precision": 1.0, "recall": 0.3333, "tp": 1}, "Goal Hallucination": {"f1": 0.0, "fn": 2, "fp": 0, "precision": 0.0, "recall": 0.0, "tp": 0}, "Hidden Operation Blindness": {"f1": 0.0, "fn": 0, "fp": 0, "precision": 0.0, "recall": 0.0, "tp": 0}, "Location Hallucination": {"f1": 1.0, "fn": 0, "fp": 0, "precision": 1.0, "recall": 1.0, "tp": 1}, "Long-Horizon Memory Failure": {"f1": 1.0, "fn": 0, "fp": 0, "precision": 1.0, "recall": 1.0, "tp": 1}, "Spatial Reasoning Error": {"f1": 1.0, "fn": 0, "fp": 0, "precision": 1.0, "recall": 1.0, "tp": 1}, "Text Matching Bias": {"f1": 1.0, "fn": 0, "fp": 0, "precision": 1.0, "recall": 1.0, "tp": 1}}, "primary": 0.7857, "primary_metric": "macro_f1"}, "holdout": {"exact_match_rate": 0.4, "macro_f1": 0.4, "mean_jaccard": 0.4, "micro_f1": 0.5714, "n": 5, "per_leaf": {"Action Looping (Repetition)": {"f1": 1.0, "fn": 0, "fp": 0, "precision": 1.0, "recall": 1.0, "tp": 1}, "Click Region Error": {"f1": 0.0, "fn": 1, "fp": 0, "precision": 0.0, "recall": 0.0, "tp": 0}, "Goal Hallucination": {"f1": 0.0, "fn": 1, "fp": 0, "precision": 0.0, "recall": 0.0, "tp": 0}, "Hidden Operation Blindness": {"f1": 0.0, "fn": 1, "fp": 0, "precision": 0.0, "recall": 0.0, "tp": 0}, "Location Hallucination": {"f1": 1.0, "fn": 0, "fp": 0, "precision": 1.0, "recall": 1.0, "tp": 1}, "Long-Horizon Memory Failure": {"f1": 0.0, "fn": 0, "fp": 0, "precision": 0.0, "recall": 0.0, "tp": 0}, "Spatial Reasoning Error": {"f1": 0.0, "fn": 0, "fp": 0, "precision": 0.0, "recall": 0.0, "tp": 0}, "Text Matching Bias": {"f1": 0.0, "fn": 0, "fp": 0, "precision": 0.0, "recall": 0.0, "tp": 0}}, "primary": 0.4, "primary_metric": "macro_f1"}}, "timestamp": "2026-08-10T23:34:05Z", "verdict": "discarded"}
{"candidate_hash": "ff80a91f8a364f29", "candidate_name": "grid-0026[far_threshold_px=80.0,long_horizon_threshold_ratio=0.85,min_repeat=2,near_margin_ratio=5.0]", "cost_usd": 0.0, "delta_vs_best": 0.0, "eval_set_hash": "20c83ed3cbce3d37", "executor": "detector", "experiment_id": "exp-0027", "notes": "tier1.py defaults + judge protocol v1", "parent_hash": "308d125283a522f3", "primary_calibration": 0.8286, "primary_holdout": 0.6, "run_id": "det-grid-001", "scores": {"calibration": {"exact_match_rate": 0.75, "macro_f1": 0.8286, "mean_jaccard": 0.7917, "micro_f1": 0.8696, "n": 12, "per_leaf": {"Action Looping (Repetition)": {"f1": 1.0, "fn": 0, "fp": 0, "precision": 1.0, "recall": 1.0, "tp": 4}, "Click Region Error": {"f1": 0.8, "fn": 1, "fp": 0, "precision": 1.0, "recall": 0.6667, "tp": 2}, "Goal Hallucination": {"f1": 0.0, "fn": 2, "fp": 0, "precision": 0.0, "recall": 0.0, "tp": 0}, "Hidden Operation Blindness": {"f1": 0.0, "fn": 0, "fp": 0, "precision": 0.0, "recall": 0.0, "tp": 0}, "Location Hallucination": {"f1": 1.0, "fn": 0, "fp": 0, "precision": 1.0, "recall": 1.0, "tp": 1}, "Long-Horizon Memory Failure": {"f1": 1.0, "fn": 0, "fp": 0, "precision": 1.0, "recall": 1.0, "tp": 1}, "Spatial Reasoning Error": {"f1": 1.0, "fn": 0, "fp": 0, "precision": 1.0, "recall": 1.0, "tp": 1}, "Text Matching Bias": {"f1": 1.0, "fn": 0, "fp": 0, "precision": 1.0, "recall": 1.0, "tp": 1}}, "primary": 0.8286, "primary_metric": "macro_f1"}, "holdout": {"exact_match_rate": 0.6, "macro_f1": 0.6, "mean_jaccard": 0.6, "micro_f1": 0.75, "n": 5, "per_leaf": {"Action Looping (Repetition)": {"f1": 1.0, "fn": 0, "fp": 0, "precision": 1.0, "recall": 1.0, "tp": 1}, "Click Region Error": {"f1": 1.0, "fn": 0, "fp": 0, "precision": 1.0, "recall": 1.0, "tp": 1}, "Goal Hallucination": {"f1": 0.0, "fn": 1, "fp": 0, "precision": 0.0, "recall": 0.0, "tp": 0}, "Hidden Operation Blindness": {"f1": 0.0, "fn": 1, "fp": 0, "precision": 0.0, "recall": 0.0, "tp": 0}, "Location Hallucination": {"f1": 1.0, "fn": 0, "fp": 0, "precision": 1.0, "recall": 1.0, "tp": 1}, "Long-Horizon Memory Failure": {"f1": 0.0, "fn": 0, "fp": 0, "precision": 0.0, "recall": 0.0, "tp": 0}, "Spatial Reasoning Error": {"f1": 0.0, "fn": 0, "fp": 0, "precision": 0.0, "recall": 0.0, "tp": 0}, "Text Matching Bias": {"f1": 0.0, "fn": 0, "fp": 0, "precision": 0.0, "recall": 0.0, "tp": 0}}, "primary": 0.6, "primary_metric": "macro_f1"}}, "timestamp": "2026-08-10T23:34:05Z", "verdict": "discarded"}
{"candidate_hash": "62680ee2f62f8591", "candidate_name": "grid-0027[far_threshold_px=80.0,long_horizon_threshold_ratio=0.85,min_repeat=3,near_margin_ratio=1.5]", "cost_usd": 0.0, "delta_vs_best": -0.0633, "eval_set_hash": "20c83ed3cbce3d37", "executor": "detector", "experiment_id": "exp-0028", "notes": "tier1.py defaults + judge protocol v1", "parent_hash": "308d125283a522f3", "primary_calibration": 0.7653, "primary_holdout": 0.2, "run_id": "det-grid-001", "scores": {"calibration": {"exact_match_rate": 0.5833, "macro_f1": 0.7653, "mean_jaccard": 0.625, "micro_f1": 0.7619, "n": 12, "per_leaf": {"Action Looping (Repetition)": {"f1": 0.8571, "fn": 1, "fp": 0, "precision": 1.0, "recall": 0.75, "tp": 3}, "Click Region Error": {"f1": 0.5, "fn": 2, "fp": 0, "precision": 1.0, "recall": 0.3333, "tp": 1}, "Goal Hallucination": {"f1": 0.0, "fn": 2, "fp": 0, "precision": 0.0, "recall": 0.0, "tp": 0}, "Hidden Operation Blindness": {"f1": 0.0, "fn": 0, "fp": 0, "precision": 0.0, "recall": 0.0, "tp": 0}, "Location Hallucination": {"f1": 1.0, "fn": 0, "fp": 0, "precision": 1.0, "recall": 1.0, "tp": 1}, "Long-Horizon Memory Failure": {"f1": 1.0, "fn": 0, "fp": 0, "precision": 1.0, "recall": 1.0, "tp": 1}, "Spatial Reasoning Error": {"f1": 1.0, "fn": 0, "fp": 0, "precision": 1.0, "recall": 1.0, "tp": 1}, "Text Matching Bias": {"f1": 1.0, "fn": 0, "fp": 0, "precision": 1.0, "recall": 1.0, "tp": 1}}, "primary": 0.7653, "primary_metric": "macro_f1"}, "holdout": {"exact_match_rate": 0.2, "macro_f1": 0.2, "mean_jaccard": 0.2, "micro_f1": 0.3333, "n": 5, "per_leaf": {"Action Looping (Repetition)": {"f1": 0.0, "fn": 1, "fp": 0, "precision": 0.0, "recall": 0.0, "tp": 0}, "Click Region Error": {"f1": 0.0, "fn": 1, "fp": 0, "precision": 0.0, "recall": 0.0, "tp": 0}, "Goal Hallucination": {"f1": 0.0, "fn": 1, "fp": 0, "precision": 0.0, "recall": 0.0, "tp": 0}, "Hidden Operation Blindness": {"f1": 0.0, "fn": 1, "fp": 0, "precision": 0.0, "recall": 0.0, "tp": 0}, "Location Hallucination": {"f1": 1.0, "fn": 0, "fp": 0, "precision": 1.0, "recall": 1.0, "tp": 1}, "Long-Horizon Memory Failure": {"f1": 0.0, "fn": 0, "fp": 0, "precision": 0.0, "recall": 0.0, "tp": 0}, "Spatial Reasoning Error": {"f1": 0.0, "fn": 0, "fp": 0, "precision": 0.0, "recall": 0.0, "tp": 0}, "Text Matching Bias": {"f1": 0.0, "fn": 0, "fp": 0, "precision": 0.0, "recall": 0.0, "tp": 0}}, "primary": 0.2, "primary_metric": "macro_f1"}}, "timestamp": "2026-08-10T23:34:05Z", "verdict": "discarded"}
{"candidate_hash": "bd6162b45585b80e", "candidate_name": "grid-0028[far_threshold_px=80.0,long_horizon_threshold_ratio=0.85,min_repeat=3,near_margin_ratio=3.0]", "cost_usd": 0.0, "delta_vs_best": -0.0633, "eval_set_hash": "20c83ed3cbce3d37", "executor": "detector", "experiment_id": "exp-0029", "notes": "tier1.py defaults + judge protocol v1", "parent_hash": "308d125283a522f3", "primary_calibration": 0.7653, "primary_holdout": 0.2, "run_id": "det-grid-001", "scores": {"calibration": {"exact_match_rate": 0.5833, "macro_f1": 0.7653, "mean_jaccard": 0.625, "micro_f1": 0.7619, "n": 12, "per_leaf": {"Action Looping (Repetition)": {"f1": 0.8571, "fn": 1, "fp": 0, "precision": 1.0, "recall": 0.75, "tp": 3}, "Click Region Error": {"f1": 0.5, "fn": 2, "fp": 0, "precision": 1.0, "recall": 0.3333, "tp": 1}, "Goal Hallucination": {"f1": 0.0, "fn": 2, "fp": 0, "precision": 0.0, "recall": 0.0, "tp": 0}, "Hidden Operation Blindness": {"f1": 0.0, "fn": 0, "fp": 0, "precision": 0.0, "recall": 0.0, "tp": 0}, "Location Hallucination": {"f1": 1.0, "fn": 0, "fp": 0, "precision": 1.0, "recall": 1.0, "tp": 1}, "Long-Horizon Memory Failure": {"f1": 1.0, "fn": 0, "fp": 0, "precision": 1.0, "recall": 1.0, "tp": 1}, "Spatial Reasoning Error": {"f1": 1.0, "fn": 0, "fp": 0, "precision": 1.0, "recall": 1.0, "tp": 1}, "Text Matching Bias": {"f1": 1.0, "fn": 0, "fp": 0, "precision": 1.0, "recall": 1.0, "tp": 1}}, "primary": 0.7653, "primary_metric": "macro_f1"}, "holdout": {"exact_match_rate": 0.2, "macro_f1": 0.2, "mean_jaccard": 0.2, "micro_f1": 0.3333, "n": 5, "per_leaf": {"Action Looping (Repetition)": {"f1": 0.0, "fn": 1, "fp": 0, "precision": 0.0, "recall": 0.0, "tp": 0}, "Click Region Error": {"f1": 0.0, "fn": 1, "fp": 0, "precision": 0.0, "recall": 0.0, "tp": 0}, "Goal Hallucination": {"f1": 0.0, "fn": 1, "fp": 0, "precision": 0.0, "recall": 0.0, "tp": 0}, "Hidden Operation Blindness": {"f1": 0.0, "fn": 1, "fp": 0, "precision": 0.0, "recall": 0.0, "tp": 0}, "Location Hallucination": {"f1": 1.0, "fn": 0, "fp": 0, "precision": 1.0, "recall": 1.0, "tp": 1}, "Long-Horizon Memory Failure": {"f1": 0.0, "fn": 0, "fp": 0, "precision": 0.0, "recall": 0.0, "tp": 0}, "Spatial Reasoning Error": {"f1": 0.0, "fn": 0, "fp": 0, "precision": 0.0, "recall": 0.0, "tp": 0}, "Text Matching Bias": {"f1": 0.0, "fn": 0, "fp": 0, "precision": 0.0, "recall": 0.0, "tp": 0}}, "primary": 0.2, "primary_metric": "macro_f1"}}, "timestamp": "2026-08-10T23:34:05Z", "verdict": "discarded"}
{"candidate_hash": "4bda5f9c2c0ba83e", "candidate_name": "grid-0029[far_threshold_px=80.0,long_horizon_threshold_ratio=0.85,min_repeat=3,near_margin_ratio=5.0]", "cost_usd": 0.0, "delta_vs_best": -0.0204, "eval_set_hash": "20c83ed3cbce3d37", "executor": "detector", "experiment_id": "exp-0030", "notes": "tier1.py defaults + judge protocol v1", "parent_hash": "308d125283a522f3", "primary_calibration": 0.8082, "primary_holdout": 0.4, "run_id": "det-grid-001", "scores": {"calibration": {"exact_match_rate": 0.6667, "macro_f1": 0.8082, "mean_jaccard": 0.7083, "micro_f1": 0.8182, "n": 12, "per_leaf": {"Action Looping (Repetition)": {"f1": 0.8571, "fn": 1, "fp": 0, "precision": 1.0, "recall": 0.75, "tp": 3}, "Click Region Error": {"f1": 0.8, "fn": 1, "fp": 0, "precision": 1.0, "recall": 0.6667, "tp": 2}, "Goal Hallucination": {"f1": 0.0, "fn": 2, "fp": 0, "precision": 0.0, "recall": 0.0, "tp": 0}, "Hidden Operation Blindness": {"f1": 0.0, "fn": 0, "fp": 0, "precision": 0.0, "recall": 0.0, "tp": 0}, "Location Hallucination": {"f1": 1.0, "fn": 0, "fp": 0, "precision": 1.0, "recall": 1.0, "tp": 1}, "Long-Horizon Memory Failure": {"f1": 1.0, "fn": 0, "fp": 0, "precision": 1.0, "recall": 1.0, "tp": 1}, "Spatial Reasoning Error": {"f1": 1.0, "fn": 0, "fp": 0, "precision": 1.0, "recall": 1.0, "tp": 1}, "Text Matching Bias": {"f1": 1.0, "fn": 0, "fp": 0, "precision": 1.0, "recall": 1.0, "tp": 1}}, "primary": 0.8082, "primary_metric": "macro_f1"}, "holdout": {"exact_match_rate": 0.4, "macro_f1": 0.4, "mean_jaccard": 0.4, "micro_f1": 0.5714, "n": 5, "per_leaf": {"Action Looping (Repetition)": {"f1": 0.0, "fn": 1, "fp": 0, "precision": 0.0, "recall": 0.0, "tp": 0}, "Click Region Error": {"f1": 1.0, "fn": 0, "fp": 0, "precision": 1.0, "recall": 1.0, "tp": 1}, "Goal Hallucination": {"f1": 0.0, "fn": 1, "fp": 0, "precision": 0.0, "recall": 0.0, "tp": 0}, "Hidden Operation Blindness": {"f1": 0.0, "fn": 1, "fp": 0, "precision": 0.0, "recall": 0.0, "tp": 0}, "Location Hallucination": {"f1": 1.0, "fn": 0, "fp": 0, "precision": 1.0, "recall": 1.0, "tp": 1}, "Long-Horizon Memory Failure": {"f1": 0.0, "fn": 0, "fp": 0, "precision": 0.0, "recall": 0.0, "tp": 0}, "Spatial Reasoning Error": {"f1": 0.0, "fn": 0, "fp": 0, "precision": 0.0, "recall": 0.0, "tp": 0}, "Text Matching Bias": {"f1": 0.0, "fn": 0, "fp": 0, "precision": 0.0, "recall": 0.0, "tp": 0}}, "primary": 0.4, "primary_metric": "macro_f1"}}, "timestamp": "2026-08-10T23:34:05Z", "verdict": "discarded"}
{"candidate_hash": "f0773cbb727bbf80", "candidate_name": "grid-0030[far_threshold_px=80.0,long_horizon_threshold_ratio=0.95,min_repeat=2,near_margin_ratio=1.5]", "cost_usd": 0.0, "delta_vs_best": -0.0429, "eval_set_hash": "20c83ed3cbce3d37", "executor": "detector", "experiment_id": "exp-0031", "notes": "tier1.py defaults + judge protocol v1", "parent_hash": "308d125283a522f3", "primary_calibration": 0.7857, "primary_holdout": 0.4, "run_id": "det-grid-001", "scores": {"calibration": {"exact_match_rate": 0.6667, "macro_f1": 0.7857, "mean_jaccard": 0.7083, "micro_f1": 0.8182, "n": 12, "per_leaf": {"Action Looping (Repetition)": {"f1": 1.0, "fn": 0, "fp": 0, "precision": 1.0, "recall": 1.0, "tp": 4}, "Click Region Error": {"f1": 0.5, "fn": 2, "fp": 0, "precision": 1.0, "recall": 0.3333, "tp": 1}, "Goal Hallucination": {"f1": 0.0, "fn": 2, "fp": 0, "precision": 0.0, "recall": 0.0, "tp": 0}, "Hidden Operation Blindness": {"f1": 0.0, "fn": 0, "fp": 0, "precision": 0.0, "recall": 0.0, "tp": 0}, "Location Hallucination": {"f1": 1.0, "fn": 0, "fp": 0, "precision": 1.0, "recall": 1.0, "tp": 1}, "Long-Horizon Memory Failure": {"f1": 1.0, "fn": 0, "fp": 0, "precision": 1.0, "recall": 1.0, "tp": 1}, "Spatial Reasoning Error": {"f1": 1.0, "fn": 0, "fp": 0, "precision": 1.0, "recall": 1.0, "tp": 1}, "Text Matching Bias": {"f1": 1.0, "fn": 0, "fp": 0, "precision": 1.0, "recall": 1.0, "tp": 1}}, "primary": 0.7857, "primary_metric": "macro_f1"}, "holdout": {"exact_match_rate": 0.4, "macro_f1": 0.4, "mean_jaccard": 0.4, "micro_f1": 0.5714, "n": 5, "per_leaf": {"Action Looping (Repetition)": {"f1": 1.0, "fn": 0, "fp": 0, "precision": 1.0, "recall": 1.0, "tp": 1}, "Click Region Error": {"f1": 0.0, "fn": 1, "fp": 0, "precision": 0.0, "recall": 0.0, "tp": 0}, "Goal Hallucination": {"f1": 0.0, "fn": 1, "fp": 0, "precision": 0.0, "recall": 0.0, "tp": 0}, "Hidden Operation Blindness": {"f1": 0.0, "fn": 1, "fp": 0, "precision": 0.0, "recall": 0.0, "tp": 0}, "Location Hallucination": {"f1": 1.0, "fn": 0, "fp": 0, "precision": 1.0, "recall": 1.0, "tp": 1}, "Long-Horizon Memory Failure": {"f1": 0.0, "fn": 0, "fp": 0, "precision": 0.0, "recall": 0.0, "tp": 0}, "Spatial Reasoning Error": {"f1": 0.0, "fn": 0, "fp": 0, "precision": 0.0, "recall": 0.0, "tp": 0}, "Text Matching Bias": {"f1": 0.0, "fn": 0, "fp": 0, "precision": 0.0, "recall": 0.0, "tp": 0}}, "primary": 0.4, "primary_metric": "macro_f1"}}, "timestamp": "2026-08-10T23:34:05Z", "verdict": "discarded"}
